問題,答え,読み
海洋プレートが大陸プレートの下に沈み込む際、海洋プレートの上の堆積物がはぎ取られ、大陸プレートのふちにくっついたもののことを地質学の用語で何という？,付加体,ふかたい
カツラの木があるという伝説にちなむ「玉桂(たまかつら)」、ウサギが住むという伝説にちなむ「玉兎(ぎょくと)」といえば、ずばり何の別名？,月,つき
1989年に革命が起きるまで、長きにわたってチャウシェスク大統領による独裁政権が行われていた、東欧の国はどこ？,ルーマニア,ルーマニア
鳥の羽や貝殻を用いて作られることもある、ハワイの人が歓迎やお祝いの気持ちを込めて首にかける飾りは何？,レイ,レイ
フランスの画家・ボージャンの『巻菓子のある静物』という絵画をヒントに生み出された、老舗洋菓子メーカーのヨックモックが販売するお菓子は何？,シガール,シガール
1970年代にコンピュータを駆使した4年がかりの照明によって肯定的に解決された、地図上の隣り合う土地を題材とした数学上の問題はなに？,四色問題,よんしょくもんだい
江戸時代に入ってから書かれた『正忍記(しょうにんき)』や『万川集海(ばんせんしゅうか)』といえば、それまで秘密裏に伝えられてきた、どんなことについて記した書物？,忍術(忍者),にんじゅつ(にんじゃ)
ショパンは最も有名な第2番をはじめ20あまりの作品を残した、主にピアノのために作られ、夜を思わせるゆったりとしたテンポのものが一般的な楽曲の種類は何？,ノクターン,ノクターン
2026年には日本を上回り、名目GDPで世界4位に浮上する見込みとなっているアジアの国はどこでしょう？,インド,インド
SiriやGoogleアシスタントにライトを点灯するための言葉として実装されている、「ハリー・ポッター」シリーズでおなじみの呪文は何？,ルーモス,ルーモス
周辺地域で多くの部品が製造されている縁から、敷地内の商業施設にボーイング787の初号機の実物が展示されている、愛知県常滑市に位置する国際空港は何？,中部国際空港,ちゅうぶこくさいくうこう
ファースト、サード、レフトの3ポジションを守れるユーティリティープレーヤーとしての一面も持つ、読売ジャイアンツの4番としてチームを牽引するスラッガーは誰？,岡本和真,おかもと かずま
水難事故から身を守るために体育の授業などで指導が行われる、服を着た状態で水に溺れないようにするための対処法を一般に何という？,着衣泳,ちゃくいえい
ファンからは親しみをこめて「モーさま」と呼ばれている、『トーマの心臓』『ポーの一族』などの作品で少女漫画の黄金期を築いた漫画家は誰？,萩尾望都,はぎお もと
「ケリー」「コッヘル」「ペアン」などの種類がある、外科手術で使用されるはさみのような形の医療器具を総称して何という？,鉗子,かんし
揺れる船の上で醤油を使わずに作れる魚料理として考案された、味の切り身を味噌や薬味と一緒にたたいた千葉県の郷土料理は何？,なめろう,なめろう
首相暗殺の濡れ衣を着せられた青年・青柳雅春(あおやぎ まさはる)の数奇な逃亡劇を描いた、本屋大賞も受賞した伊坂幸太郎の小説は何？,『ゴールデンスラバー』,ゴールデンスラバー
特徴的な模様を持つ種類は「カールおじさん」や「ウルトラマン」と呼ばれダイバーたちの間で親しまれている、漢字では「海鞘(うみのさや)」と書く生き物は何？,ホヤ,ホヤ
キャンパスから車で10分ほどの場所にGoogle本社が位置している、Google創業者のラリー・イジとセルゲイ・プリンが在籍していた名門大学は何？,スタンフォード大学,スタンフォードだいがく
富士パックスが販売するシートタイプの「パチカット」や、ライオンが販売するスプレータイプの「エレガード」といえば、何の対策のためのグッズ？,静電気,せいでんき
高校入学時の自己紹介で口にした「ただの人間には興味ありません」という言葉も有名な、谷川流(たにがわ ながる)のライトノベルの登場人物は誰？,涼宮ハルヒ,すずみやハルヒ
卓球の国際的な競技規則において、ラケットの少なくとも片方の面は、何色にしなければならないと決められている？,黒,くろ
「人生、全とっかえ。」というコンセプトをかかげ、今年(2024年)3月、お台場にオープンした、没入型アトラクションが楽しめるテーマパークは何？,イマーシブ・フォート東京,イマーシブ・フォートとうきょう
サントメ・プリンシペ、セントクリストファー・ネービス、シリア、パナマに共通する、国旗に書かれた星の数はいくつ？,２つ,２つ
これをもちいた製品が最初に売り出された際は「鋼鉄よりも強く、くもの糸より細い」というキャッチコピーで宣伝された、1935年に開発された世界初の合成繊維は何？,ナイロン,ナイロン
童謡『おもちゃのチャチャチャ』の作詞も手掛けている、自身の戦争体験をもとに『アメリカひじき』や『火垂るの墓』などの小説を残した作家は誰？,野坂昭如,のさか あきゆき
ちゃんぴおんずやママタルトといった若手芸人も所属している、毎月、浅草の「東洋館」で寄席を主催している団体は何？,漫才協会,まんざいきょうかい
第一次オイルショックによる不景気の中発売された、「幸せが戻ってきてほしい」という思いから名づけられた亀田製菓のお菓子は何？,ハッピーターン,ハッピーターン
災害時の安否確認サービス「Q-ANPI」や災害の危機管理通報を行う「災害通報」などに利用されている、「日本版GPS」ともよばれる衛星測位システムは何？,みちびき,みちびき
ハートやリーフの模様を描ける「フリーポア」や、より細かい絵を表現できる「エッジング」といえば、何をするときの技法？,ラテアート,ラテアート
人体組織との適合性が高く、ペースメーカーの容器や人工関節といった医療器具の材料としてよく用いられる、元素記号Tiの金属元素は何？,チタン,チタン
古くから門前町では特徴的な「逆さ門松」を飾る風習がある、毎年1月の「福男選び」で有名な兵庫県の神社はどこ？,西宮神社,にしのみやじんじゃ
「身近な社会的な話題」についてのコミュニケーション能力が求められる、来年度(2025年)から英検の準2級と2級の間に新設される級は何？,準2級プラス,じゅん2きゅうプラス
昨年(2023年)、やばいTシャツ屋さんのありぼぼとの結婚を発表した、ユニット「怪奇！YesどんぐりRPG」の一員としても知られるピン芸人は誰？,どんぐりたけし,どんぐりたけし
1980年代に『ルパン三世』の劇場版作品を手掛ける企画があったが幻に終わっている、『GOHST IN THE SHELL/攻殻機動隊』などの作品で知られるアニメ監督は誰？,押井守,おしい まもる
『ふたりはいっしょ』や『ふたりはいつもともだち』といった続編もある、仲良しのがまくんとかえるくんのお話がおさめられたアーノルド・ローベルの絵本は何？,『ふたりはともだち』,ふたりはともだち
2006年に創設され、現在は全国に9000か所以上存在する、幼稚園と保育園の機能をあわせ持った施設は何？,認定こども園,にんていこどもえん
「生物がよく使う部分は発達し、使わない部分は退化する」という、生物学者のラマルクが提唱した進化に関するかつての学説を何という？,用不用説,ようふようせつ
洋服のタグなどでは「PRC」、スポーツの中継などでは「CHN」と略記される、東アジアの国はどこ？,中国,ちゅうごく
山東京伝(さんとうきょうでん)に入門し、初めは黄表紙(きびょうし)を書いていた、読本の『椿説弓張月(ちんせつゆみはりづき)』や『南総里見八犬伝』で知られる江戸時代の戯作者は誰？,滝沢馬琴,たきざわ ばきん
主な国際大会には「Red Bull BC One」などがある、今年(2024年)のパリ五輪ではAmiやShigekixといった日本人選手が活躍した競技は何？,ブレイキン,ブレイキン
第二次世界大戦中にたった一晩で作曲した逸話でも有名な、バレエ音楽『ガイーヌ』の再終幕で演奏されるハチャトゥリアンの楽曲は何？,『剣の舞』,つるぎのまい
